{
  "schemaVersion": 1,
  "profileId": "heroine",
  "defaultSetId": "neutral",
  "sets": [
    {
      "id": "neutral",
      "label": "Neutral",
      "eyes": "neutral",
      "nose": "default",
      "mouth": "neutral",
      "details": ["soft_blush"]
    },
    {
      "id": "talking",
      "label": "Talking",
      "eyes": "neutral",
      "nose": "default",
      "mouth": "talking",
      "details": ["soft_blush"]
    },
    {
      "id": "happy",
      "label": "Happy",
      "eyes": "happy",
      "nose": "default",
      "mouth": "smile",
      "details": ["soft_blush"]
    },
    {
      "id": "sad",
      "label": "Sad",
      "eyes": "sad",
      "nose": "default",
      "mouth": "sad",
      "details": ["soft_blush"]
    },
    {
      "id": "angry",
      "label": "Angry",
      "eyes": "angry",
      "nose": "default",
      "mouth": "angry_teeth",
      "details": ["soft_blush"]
    },
    {
      "id": "surprised",
      "label": "Surprised",
      "eyes": "surprised",
      "nose": "default",
      "mouth": "talking",
      "details": ["soft_blush"]
    }
  ]
}
